{
  "model_card_schema_version": "1.1",
  "model_card_id": "dhaka_south_random_forest_benchmark",
  "model_card_version": "p1.3-v1",
  "model_id": "random_forest",
  "model_version": "p1.3-v1",
  "deployment_id": "dhaka_south",
  "model_family": "RandomForestRegressor",
  "active_model_family": "RandomForestRegressor",
  "estimator_library": "scikit-learn",
  "active_model_library": "scikit-learn",
  "estimator_library_version": "1.9.0",
  "active_model_library_version": "1.9.0",
  "target": "target_cases_next_2w",
  "forecast_horizon": {
    "value": 14,
    "unit": "days"
  },
  "feature_formula_ids": [
    "TARGET.HORIZON.2W",
    "FEATURE.CASE_LAGS",
    "FEATURE.CLIMATE_LAGS",
    "FEATURE.CASE_ROLLING",
    "FEATURE.GROWTH_RATIOS",
    "FEATURE.SEASONAL_CYCLIC",
    "FEATURE.SEASON_FLAGS"
  ],
  "selected_features": [
    "rainfall_lag_2w",
    "rainfall_lag_4w",
    "temp_lag_2w",
    "temp_lag_4w",
    "humidity_lag_2w",
    "humidity_lag_4w",
    "cases_lag_1w",
    "cases_lag_2w",
    "cases_lag_4w",
    "cases_rolling_3w",
    "cases_rolling_4w",
    "cases_rolling_8w",
    "growth_rate_1w",
    "growth_rate_2w",
    "epi_week_sin",
    "epi_week_cos",
    "monsoon_flag",
    "post_monsoon_flag"
  ],
  "training_period": {
    "start": {
      "epi_year": 2021,
      "epi_week": 6
    },
    "end": {
      "epi_year": 2024,
      "epi_week": 22
    }
  },
  "data_sources": {
    "cases": "synthetic_benchmark",
    "climate": "synthetic_benchmark",
    "operational": "synthetic_benchmark"
  },
  "data_mode": "synthetic_capability_demonstration",
  "observed_data_mode": "synthetic",
  "validation_method": "expanding_window_rolling_origin_candidate_comparison",
  "baseline_models": [
    "previous_week_naive",
    "moving_average_4w",
    "seasonal_naive_52w"
  ],
  "performance_metrics": {
    "active_random_forest_rolling": {
      "fold_count": 68,
      "successful_folds": 68,
      "failed_folds": 0,
      "mae": 31.726076401608665,
      "rmse": 49.55526308662114,
      "wape": 26.783031599123394,
      "mape": 34.634839440791076,
      "median_absolute_error": 22.102701738885596,
      "maximum_absolute_error": 261.22750415131503,
      "minimum_absolute_error": 0.8231799740493955,
      "absolute_error_standard_deviation": 38.068099187423655,
      "q1": 12.206125964318717,
      "q3": 36.41474372951318,
      "iqr": 24.20861776519446,
      "negative_raw_prediction_count": 0,
      "clipping_count": 0,
      "convergence_warning_count": 0,
      "runtime_seconds": 13.930713200001264
    },
    "legacy_gbr_holdout": {
      "mae": 28.75,
      "rmse": 35.9,
      "mape": 42.28
    },
    "legacy_gbr_rolling": {
      "fold_count": 68,
      "mae": 33.45498524791433,
      "rmse": 51.19793472892898,
      "mape": 34.8344423028676,
      "mape_included_row_count": 68,
      "mape_zero_actual_exclusion_count": 0,
      "wape": 28.24256979339757,
      "wape_exclusion_reason": null,
      "median_absolute_error": 25.731839481745702,
      "absolute_error_standard_deviation": 38.7555477650556,
      "minimum_absolute_error": 1.2298987500083172,
      "maximum_absolute_error": 259.0353191448207,
      "q1_absolute_error": 14.109921153465145,
      "q3_absolute_error": 37.70340909680314,
      "iqr_absolute_error": 23.593487943337998
    },
    "selected_random_forest_holdout": {
      "rmse": 33.24672789381382
    }
  },
  "model_selection_status": "comparison_complete_and_adopted",
  "comparison_selected_model": "random_forest",
  "current_forecast_model": "random_forest",
  "selected_model_adoption_status": "adopted_p1.2b",
  "adoption_status": "adopted_p1.2b",
  "adoption_policy_version": "p1.2b-v1",
  "adopted_model_parameters_sha256": "ac37d2d2947de2f6004d39ecdfa3290c5d65901b796f1eb1fd248ad658e1b1e0",
  "candidate_model_comparison_artifact_path": "data/candidate_model_comparison.json",
  "candidate_model_comparison_artifact_sha256": "aca48af0fca992968a59f2c12845960520248bdfab851b7cddc6d7192a12352e",
  "comparison_artifact_sha256": "aca48af0fca992968a59f2c12845960520248bdfab851b7cddc6d7192a12352e",
  "candidate_registry_version": "p1.2a-v1",
  "candidate_registry_sha256": "2e627f8a368a7e92cebd4ad62139b1050c7614559affd620e9a41738fd6a25d4",
  "candidate_models": [
    "previous_week_naive",
    "moving_average_4w",
    "seasonal_naive_52w",
    "ridge_regression",
    "poisson_regression",
    "random_forest",
    "gradient_boosting"
  ],
  "primary_selection_metric": "MAE",
  "selection_rule": "lowest rolling-origin MAE among candidates completing all 68 folds; deterministic declared tie sequence",
  "comparison_selected_model_reason": "random_forest had the lowest eligible rolling-origin MAE under the predeclared p1.2a-v1 rule.",
  "selected_model_rank": 1,
  "selected_model_fold_count": 68,
  "selected_model_failures": 0,
  "comparison_limitations": [
    "Candidate models were compared on identical leakage-controlled rolling-origin folds using deterministic synthetic benchmark data. The selected model is a technical demonstration choice and does not establish real-world Dhaka superiority.",
    "Rolling folds and targets are temporally dependent; paired summaries are descriptive and no significance claims are made.",
    "The comparison winner is not adopted in P1.2A; P0.4 explainability and legacy uncertainty remain bound to Gradient Boosting."
  ],
  "primary_validation_method": "expanding_window_rolling_origin",
  "rolling_validation_artifact_path": "data/rolling_validation.json",
  "rolling_validation_artifact_sha256": "e2f0583d539ad339df20d9c7583c7e7abf36e5a68c2bb868657494ee89f54f69",
  "rolling_validation_version": "p1.1-v1",
  "rolling_fold_count": 68,
  "rolling_initial_training_window": 104,
  "rolling_step_weeks": 1,
  "rolling_horizon_weeks": 2,
  "rolling_aggregate_metrics": {
    "fold_count": 68,
    "successful_folds": 68,
    "failed_folds": 0,
    "mae": 31.726076401608665,
    "rmse": 49.55526308662114,
    "wape": 26.783031599123394,
    "mape": 34.634839440791076,
    "median_absolute_error": 22.102701738885596,
    "maximum_absolute_error": 261.22750415131503,
    "minimum_absolute_error": 0.8231799740493955,
    "absolute_error_standard_deviation": 38.068099187423655,
    "q1": 12.206125964318717,
    "q3": 36.41474372951318,
    "iqr": 24.20861776519446,
    "negative_raw_prediction_count": 0,
    "clipping_count": 0,
    "convergence_warning_count": 0,
    "runtime_seconds": 13.930713200001264
  },
  "rolling_baseline_comparison": {
    "previous_week_naive": {
      "better_fold_count": 33,
      "tied_fold_count": 0,
      "worse_fold_count": 35
    },
    "moving_average_4w": {
      "better_fold_count": 29,
      "tied_fold_count": 0,
      "worse_fold_count": 39
    },
    "seasonal_naive_52w": {
      "better_fold_count": 30,
      "tied_fold_count": 0,
      "worse_fold_count": 38
    },
    "ridge_regression": {
      "better_fold_count": 34,
      "tied_fold_count": 0,
      "worse_fold_count": 34
    },
    "poisson_regression": {
      "better_fold_count": 36,
      "tied_fold_count": 0,
      "worse_fold_count": 32
    },
    "random_forest": {
      "better_fold_count": 0,
      "tied_fold_count": 68,
      "worse_fold_count": 0
    },
    "gradient_boosting": {
      "better_fold_count": 34,
      "tied_fold_count": 0,
      "worse_fold_count": 34
    }
  },
  "performance_variability": {
    "source": "candidate_model_comparison.json",
    "active_model": "random_forest"
  },
  "native_importance_stability_status": "not_evaluated_across_temporal_folds",
  "permutation_stability_status": "not_evaluated_single_row_folds",
  "legacy_validation_method": "time_based_holdout_final_20_percent",
  "legacy_validation_artifact_path": "data/validation_metrics.json",
  "validation_limitations": [
    "Active rolling metrics come from the validated P1.2A candidate comparison.",
    "P1.1 GBR rolling metrics are historical compatibility evidence only."
  ],
  "uncertainty_method": "prequential_expanding_absolute_residual_quantile",
  "uncertainty_method_version": "p1.3-v1",
  "uncertainty_status": "temporally_evaluated_synthetic_empirical_range",
  "nominal_coverage": 0.9,
  "observed_temporal_coverage": 0.8958333333333334,
  "covered_fold_count": 43,
  "evaluated_fold_count": 48,
  "calibration_warmup_fold_count": 20,
  "interval_width_summary": {
    "average_interval_width": 146.92429694798778,
    "median_interval_width": 133.18035262412508,
    "minimum_interval_width": 80.27877645371069,
    "maximum_interval_width": 249.00190519899652
  },
  "lower_miss_count": 2,
  "upper_miss_count": 3,
  "uncertainty_artifact_path": "data/forecast_uncertainty.json",
  "uncertainty_artifact_sha256": "9994cdee7b89a55f307bed45f45e1a593d85c2130874048f34b52614c24181be",
  "residual_source_artifact_path": "data/candidate_model_comparison.json",
  "residual_source_artifact_sha256": "aca48af0fca992968a59f2c12845960520248bdfab851b7cddc6d7192a12352e",
  "uncertainty_active_model_binding": {
    "model_id": "random_forest",
    "model_parameters_sha256": "ac37d2d2947de2f6004d39ecdfa3290c5d65901b796f1eb1fd248ad658e1b1e0",
    "candidate_registry_sha256": "2e627f8a368a7e92cebd4ad62139b1050c7614559affd620e9a41738fd6a25d4",
    "comparison_artifact_sha256": "aca48af0fca992968a59f2c12845960520248bdfab851b7cddc6d7192a12352e"
  },
  "uncertainty_limitations": [
    "The empirical range was evaluated using deterministic synthetic rolling-origin Random Forest residuals. Each evaluated fold used only residuals from earlier folds. Temporal dependence and reuse of the folds for model selection limit interpretation. This is not evidence of real-world Dhaka calibration. Historical empirical coverage is not a guarantee of future coverage.",
    "Targets overlap and residuals are temporally dependent.",
    "High-incidence and rising-period performance may be weaker.",
    "The range is not a probability statement and is not a prediction interval.",